"ows_LinkTitle","ows_Zona","ows_Georeferencia","ows_CodigoPostal","ows_Direccion","ows_Telefono","ows_Fax","ows_Web","ows_Mascotas","ows_Accesibilidad","ows_FechaActualizacion","ows_Horarios","ows_TipoActividad","ows_Actividad","ows_Activo","ows_Email","ows_Municipio","ows_Categorias","ows_DistanciaPlaya","ows_DistanciaCentroComercial","ows_DistanciaPuerto","ows_DistanciaParadaBus","ows_DistanciaTFS","ows_DistanciaTFN","ows_Suites","ows_Piscinas","ows_Bares","ows_Restaurantes","ows_Habitaciones","ows_SubTipo","ows_EmpresaNombre","ows_DescripcionEspanol","ows_DescripcionIngles","ows_DescripcionAleman","ows_DescripcionRuso","ows_DescripcionItaliano","ows_ComoLlegarEspanol","ws_ComoLlegarIngles","ows_ComoLlegarAleman","ows_ComoLlegarFrances","ows_ComoLlegarItaliano","ows_HorariosIngles","ows_HorariosAleman","ows_HorariosFrances","ows_HorariosItaliano"
"Villa Montemar","Norte","(28.3971481879871, -16.58212423324585)","38418","C/ El Parque, 6","922 36 39 50","922 36 38 68","http://www.villa-montemar.com","","","2011-11-23 13:39:07","","Hotel","Alojamientos","1","info@villa-montemar.com","Realejos (Los)","Animales,Gimnasio,Golf,Hidromasaje,Jardín-Terraza,Mini-Bar,Parking,Piscina climatizada,Recepción,Sala lectura,Sala TV,Sauna,Serv. habitaciones,Solarium,Teléfono en habitación,Televisión,Terraza,TV Sat.,Zona naturista,","","","","","","","","","","","6","3 estrellas","",".Esta villa de lujo mezcla la luz que fluye en las habitaciones de arquitectura moderna con elementos tradicionales canario-hispanos en qual puede pasar unas vacaciones inolvidables. Esta Villa de lujo en el Hotel Montemar esta situada separadamente de la casa principal. Sobre 2 plantas con 250m² de superficie, marmol blanco y alfombras persa, Villa Tessa dispone de 3 dormitorios, 2 baños de lujo, un gran salón y calefacción central en todas las habitaciones, cocina con horno de indución, estufa y lavavajillas. El parque de palmeras de 2000m² esta a disposición privada de los ocupantes y para su bienestar encuentra en Villa Tessa una sauna y un fitness. Todas las habitaciones tienen vista al mar, como igualmente vista a la costa impressionante del norte de Tenerife y las montañas.  Su luna de miel o vacaciones en familia en un ambiente unico en Tenerife  ","","","","","Indicaciones para llegar a la Villa Montemar en Los Realejos desde el aeropuerto Norte ""Los Rodeos"" Se sale del aeropuerto a la autopista dirección Puerto de la Cruz y sigue en ella hasta pasar Tacoronte, La Matanza, el Sauzal desde donde hay una vista marvillosa del Teide, Santa Ursula!   Las salidas están numeradas. Después de la salida del Puerto de la Cruz coge la salida nr. 36 en dirección La Vera. (Este es el camino más fácil). La calle va paralela a la autopista y siempre al otro lado hay plantaciones de plátanos. A la izquierda hay una gasolinera y después en el siguiente cruce nos dirigimos a la derecha, por esta calle se llega directamente a la Longuera y después a la izquierda en la calle La Longuera dejando el Hotel Panorámica Garden atrás. El siguiente cruce a la derecha es la Calle El Parque. Cuando llegan a un aparcamiento, ya no queda lejos. Está en el sitio correcto!  Indicaciones para llegar a la Villa Montemar en Los Realejos desde el aeropuerto Sur ""Reina Sofia"" Salga del aeropuerto a la autopista sur dirección Santa Cruz y permanezca en la autopista, pase el Médano con su Montaña Roja - desde la autopista puede ver bien como es el seco paisaje del sur de Tenerife. No se preocupe, y mucha atención al llegar a Santa María del Mar aquí conecta con la autopista del norte, cambia el paisaje a verde. Conduzca siempre en dirección al Puerto de la Cruz!  Pasando La Laguna - que es al lado de Santa Cruz, dirección Tacoronte, La Matanza, el Sauzal, desde donde hay una vista marvillosa del Teide, Santa Ursula!   Las salidas están numeradas. Después de la salida del Puerto de la Cruz coge la salida nr. 36 en dirección La Vera. (Este es el camino más fácil). La calle va paralela a la autopista y siempre al otro lado hay plantaciones de plátanos. A la izquierda hay una gasolinera y después en el siguiente cruce nos dirigimos a la derecha, por esta calle se llega directamente a la Longuera y después a la izquierda en la calle La Longuera dejando el Hotel Panorámica Garden atrás. El siguiente cruce a la derecha es la Calle El Parque. Cuando llegan a un aparcamiento, ya no queda lejos. Está en el sitio correcto!  Indicaciones para llegar a la Villa Montemar en Los Realejos desde el aeropuerto Sur ""Reina Sofia"" Salga del aeropuerto a la autopista sur dirección Santa Cruz y permanezca en la autopista, pase el Médano con su Montaña Roja - desde la autopista puede ver bien como es el seco paisaje del sur de Tenerife. No se preocupe, y mucha atención al llegar a Santa María del Mar aquí conecta con la autopista del norte, cambia el paisaje a verde. Conduzca siempre en dirección al Puerto de la Cruz!  Pasando La Laguna - que es al lado de Santa Cruz, dirección Tacoronte, La Matanza, el Sauzal, desde donde hay una vista marvillosa del Teide, Santa Ursula!   Las salidas están numeradas. Después de la salida del Puerto de la Cruz coge la salida nr. 36 en dirección La Vera. (Este es el camino más fácil). La calle va paralela a la autopista y siempre al otro lado hay plantaciones de plátanos. A la izquierda hay una gasolinera y después en el siguiente cruce nos dirigimos a la derecha, por esta calle se llega directamente a la Longuera y después a la izquierda en la calle La Longuera dejando el Hotel Panorámica Garden atrás. El siguiente cruce a la derecha es la Calle El Parque. Cuando llegan a un aparcamiento, ya no queda lejos. Está en el sitio correcto!   ","","","","","","","",""
"Turquesa Playa","Norte","(28.2915637, -16.629130400000008)","38400","C/ Antonio Ruíz Álvarez, 7 Urb. Turquesa Playa - Playa Jardín","922 37 13 08","922 37 29 23","http://www.hotelturquesa.com","","","2011-11-24 19:18:48","","Hotel","Alojamientos","1","reservas@conybarhotels.com","Puerto de la Cruz (El)","Bar,Discoteca,Gimnasio,Inst. infantiles,Internet,Jacuzzi,MiniGolf,Peluquería,Sala conferencias,Sala Juego,Sauna,Tenis,Terraza,WIFI,","200 m.","","","","","27 km. aprox. ","","5","2","2","350","4 estrellas","Conybar Hotels","","","","","","","","","","","","","",""
"Astoria","Norte","(28.416121305218894, -16.54533326603996)","38400","C/ la Hoya, 60","922 38 45 51","","http://www.hotelastoria.com ","","","2014-01-20 19:24:42","","Apartahotel","Alojamientos","1","info@apartahotelastoria.com ","Puerto de la Cruz (El)","Adaptada (discapacitados),Cafetería,Hilo musical,Internet,Parking,Piscina climatizada,Radio en habitación,Recepción,Solarium,Teléfono en habitación,Televisión,Vigilante,WIFI,","5 minutos","200 m.","","10 minutos.","","30km. aprox. ","","","","","33","3 llaves","","","","","","","","","","","","","","",""
"Diamante Suites","Norte","(28.408663323509376, -16.557489037295454)","38400","C/ Manuel Yanes Barreto.- Urb. Playa Jardin","922 37 00 87","922 37 32 34","http://www.hoteldiamantesuites.com","","","2014-06-27 20:05:41","","Hotel","Alojamientos","1","recepción.diamantesuitess@conybarhotels.com","Puerto de la Cruz (El)","Adaptada (discapacitados),Cafetería,Gimnasio,Hilo musical,Internet,MiniGolf,Parking,Peluquería,Piscina climatizada,Piscinas,Sala lectura,Salón de convenciones,Serv. habitaciones,Serv. médico,Solarium,Teléfono en habitación,Televisión,Tenis,Terraza,WIFI,","250 m. ","","","","","27 km. aprox. ","","2","2","3","174","4 estrellas","Conybar Hotels","","","","","","","","","","","","","",""
"Garoé","Norte","(28.41280443981843, -16.53021812438965)","38400","C/ Dr. Celestino González , 3 -Urb. La Paz","922 38 29 88","922 38 83 60","http://www.hotelriugaroe.com","","","2014-04-02 10:41:20","","Hotel","Alojamientos","1","recepcion@hotelgaroe.com  ","Puerto de la Cruz (El)","Aire Acondicionado,Animales,Cafetería,Calefacción,Gimnasio,Hilo musical,Mini-Bar,MiniGolf,Ping-Pong,Piscina climatizada,Restaurante,Sauna,Squash,Tenis,TV Sat.,","1 km.","","","","","27 km. aprox. ","7","1","1","1","190","4 estrellas","RIU Hotels & Resorts","","","","","","","","","","","","","",""
"Silken Atlántida","Metropolitana","","38005","Avda. 3 de Mayo, 3 38005","922 29 45 00","922 22 44 58","http://www.hoteles-silken.com","","","2015-05-14 11:42:34","","Hotel","Alojamientos","1","hotelatlantida.sc@hoteles-silken.com","Santa Cruz de Tenerife","","8 km","500 m","2 km","20 m","","15 km","25 Junior Suites","1","2","1","144","4 estrellas","SILKEN HOTELES","Desde los ascensores panorámicos del Atlántida Santa Cruz, se puede contemplar una ciudad que mira al mar sin perder de vista la silueta de montañas que anuncian que el Teide está próximo.  El Atlántida Santa Cruz, inaugurado a finales del 2001, se halla en el nuevo centro de la ciudad, próximo a los tres nuevos iconos de la capital: el Parque Marítimo César Manrique, el Auditorio de Calatrava y el Palacio de Congresos. A poca distancia de la Playa de Las Teresitas.  Sus 144 habitaciones, veinticinco de ellas Junior Suites, están elegantemente decoradas y cuentan con un completo equipamiento. Dispone de salones con capacidad de hasta 400 personas, equipados con modernos medios audiovisuales. ","","","","","","","","","","","","",""
"Cañadas (Las)","Norte","(28.440692911386545, -16.370112061413238)","38290","Ctra. Gral  Km.7,5. La Esperanza","922 54 88 08","922 54 82 67","http://www.hotellascañadas.com","","","2014-12-15 17:16:26","","Hotel","Alojamientos","1","hotellascañadas@hotmail.com","Rosario (El)","","","","","","","","","","","","7","1 estrella","","","","","","","","","","","","","","",""
"Finca Susanna","Norte","(28.4470138, -16.37400379999997)","38290","C/ las Cabezadas, 57.- La Esperanza","922 54 86 35","","http://www.finca-susanna.com","","","2013-12-13 19:24:42","","Pensión","Alojamientos","1","info@finca-susanna.es","Rosario (El)","Televisión,","","","","","","","","","","","3","","","2 estrellas","","","","","","","","","","","","",""
"Bellavista","Norte","(28.41635485014794, -16.53689056623989)","38400","C/ Eucalipto, 4 .-Urb. La Paz-","922 38 31 11","922 38 35 18","http://www.apartamentosbellavista.com","","","2014-06-27 20:02:57","","Apartamento","Alojamientos","1","reservas@apartamentosbellavista.com","Puerto de la Cruz (El)","Adaptada (discapacitados),Animales,Lavandería,Parking,Ping-Pong,Piscina climatizada,Recepción,Sala Juego,Solarium,Terraza,TV Sat.,WIFI,Zona naturista,","200 m.","250 m. ","","","","27 km. aprox. ","","","","","186","3 llaves","","","","","","","","","","","","","","",""
"Chinyero","Norte","(28.412870494906738, -16.54364436853939)","38400","Ctra. del Botánico, 25 ","922 38 58 11","922 37 11 27","http://www.grupopezazul.es","","","2014-01-22 19:34:45","","Apartamento","Alojamientos","1","atpezazul@hotmail.com","Puerto de la Cruz (El)","Animales,","600 m. ","200 m. ","","10 m. ","","27 km. aprox. ","","","","","28","2 llaves","Grupo Pez Azul","","","","","","","","","","","","","",""
"Pez Azul","Norte","(28.41254493672126, -16.542749404907226)","38400","C/ Rector Benito Rodriguez Ríos, 1","922 38 58 11","922 37 11 27","http://www.grupopezazul.es","","","2014-01-28 19:12:28","","Apartamento","Alojamientos","1","reservas@grupopezazul.es","Puerto de la Cruz (El)","Adaptada (discapacitados),Animales,Bar,Cafetería,Internet,Internet habitación,Jardín-Terraza,Lavandería,Piscina climatizada,Piscinas,Recepción,Restaurante,Sala conferencias,Sala Juego,Sala TV,Serv. habitaciones,Serv. médico,Solarium,Teléfono en habitación,Televisión,Terraza,Todo incluido,TV Sat.,WIFI,","","","","","","27 km. aprox. ","","1","1","1","135","3 llaves","Grupo Pez Azul","","","","","","","","","","","","","",""
"Teneguía","Norte","(28.413238516305057, -16.55513048171997)","38400","Avda. Melchor Luz, 2 Políg. San Felipe","922 38 09 00","922 37 04 22","http://www.apartamentosteneguia.com","","","2014-02-10 17:28:49","","Apartamento","Alojamientos","1","info@apartamentosteneguia.com","Puerto de la Cruz (El)","Animales,Bar,Gimnasio,Internet,Jardín-Terraza,Lavandería,MiniGolf,Parking,Piscinas,Radio en habitación,Recepción,Serv. médico,Supermercado,TV Sat.,WIFI,","200 m.","","","","","27 km. aprox. ","","1","1","","177","3 llaves","","","","","","","","","","","","","","",""
"Tenerife-Ving","Norte","(28.41280443981843, -16.555527448654175)","38400","Paseo Hermanos Fernández Perdigón, 8","922 38 45 11","922 38 14 15","http://www.tenerifeving.com","","","2014-01-29 18:01:52","","Apartamento","Alojamientos","1","info@HotelTenerifeVing.com","Puerto de la Cruz (El)","Hilo musical,Inst. infantiles,Jardín-Terraza,Piscinas,Radio en habitación,Recepción,Salón de convenciones,Televisión,Terraza,","200 m.","","","50 m. ","","27 km. aprox. ","","","","","122","2 llaves","","","","","","","","","","","","","","",""
"Noelia ","Norte","(28.41224768693777, -16.555589139461517)","38400","Avenida Hnos.Fdez. Perdigón 9","922 38 42 11 ","922 37 28 47","http://www.gfhoteles.com","","","2014-01-28 17:44:42","","Apartamento","Alojamientos","1","info@gfhoteles.com","Puerto de la Cruz (El)","Aire Acondicionado,Bar,Cafetería,Internet,Lavandería,Piscinas,Recepción,Sala conferencias,Sala Juego,Sala TV,Serv. médico,Solarium,Supermercado,WIFI,","300 m. ","","","","","27 km. aprox.","","1","1","1","106","3 llaves","GF Hoteles","","","","","","","","","","","","","",""
"Masaru","Norte","(28.41488044170515, -16.537020206451416)","38400","C/ de los Robles, 2 -Urb. La Paz","922 37 00 85","922 37 03 31","http://www.apartamentosmasaru.com","","","2014-06-30 18:59:52","","Apartamento","Alojamientos","1","info@apartamentosmasaru.com","Puerto de la Cruz (El)","Hilo musical,Inst. infantiles,Internet,Jardín-Terraza,Ping-Pong,Piscina climatizada,Piscinas,Radio en habitación,Recepción,Sala conferencias,Serv. médico,Supermercado,Tenis,Terraza,TV Sat.,WIFI,","","","","","","27 km. aprox. ","","2","1","1","194","3 llaves","","","","","","","","","","","","","","",""
"Palmeras Playa","Norte","(28.416899786312594, -16.54270648956299)","38400","Avda. de Venezuela, 12","922 38 06 16","922 38 34 24","http://www.elegancehotels.es","","","2014-01-28 18:01:10","","Apartamento","Alojamientos","1","palmerasplaya@elegancehotels.es","Puerto de la Cruz (El)","Animales,Petanca,Radio en habitación,Recepción,","100 m. ","200 m. ","","","","27 km. aprox.","","","","","203","3 llaves","Thsl","","","","","","","","","","","","","",""
"Harbour Club II","Sur","(28.2435837, -16.839050000000043)","38683","Avda. José González Fortes, 53","922 86 22 73","922 86 08 58","http://www.eliteclubresort.com","","","2011-11-22 11:26:58","","Apartamento","Alojamientos","1","reception@harbourclubtfe.com","Santiago del Teide","Jardín-Terraza,Recepción,","","","","","","","","","","","29","1 llave","","","","","","","","","","","","","","",""
"Harbour Club I","Sur","(28.2972603, -16.815625400000044)","38683","Avda. José Antonio González Fortes, 26","922 86 22 73","922 86 08 58","http://www.eliteclubresort.com","","","2014-06-02 11:53:08","","Apartamento","Alojamientos","1","reception@harbourclubtfe.com","Santiago del Teide","Inst. infantiles,Jardín-Terraza,Parking,","","","","","","","","","","","32","1 llave","","","","","","","","","","","","","","",""
"Océano and Medical Spa (El)","Metropolitana","(28.5667931, -16.330869000000007)","38240","C/ Oceano Pacífico, 1. Punta del Hidalgo","922 15 60 00","922 15 63 52","http://www.oceano.de","","","2015-04-29 17:27:59","","Hotel","Alojamientos","1"," info@oceano-tenerife.com","San Cristóbal de la Laguna","","20 m","","","180 m.","","16,7 km","5","2","","1","91","4 estrellas","Carowa Hotel  SL","Hotel, Salud y Spa en Tenerife Al llegar ya se dará cuenta de que el tiempo transcurre más despacio aquí, en Punta del Hidalgo. El ambiente respira tranquilidad. Los numerosos ayudantes en el hotel y también los clientes se mueven con una sonrisa en los labios.","Hotel, Health & Spa in Tenerife The OCÉANO Hotel Health Spa on Tenerife is under its third generation of family owners, currently K. Matthias Rolle, a German doctor, and his wife, Magda Corominas Roig. K.M. Rolle and the OCÉANO team take their guests' desires to recuperate on holiday very seriously, based on proven methods of mind-body medicine. This is why the well-being, holistic recuperation and vitalisation for the mind, body and soul of each and every guest is the utmost priority.  The OCÉANO concept is based on four principles and aims to combine a long-lasting holiday with preventative and regenerative medicine. These principles are: holistic health methods, natural measures to promote health, high quality standards and ecological responsibility or the duty to preserve nature in all its glory.  The OCÉANO Hotel Health Spa is a member and recognised centre of the International Society of Mayr Doctors, was accepted into the exclusive association of Healing Hotels of the World (HHOW) in September 2013, and certified by TÜV Rheinland in December 2013 in the International Spa Standard category.","Das OCÉANO Hotel Health Spa auf Teneriffa wird bereits in dritter Generation von K. Matthias Rolle, dem deutschen Arzt und Inhaber des Hotels, zusammen mit seiner Frau Magda Corominas Roig geführt. Auf Grundlage bewährter Methoden der Mind-Body-Medizin nimmt K. M. Rolle und sein OCÉANO-Team den Wunsch seiner Gäste, sich im Urlaub zu erholen, sehr ernst. Deshalb stehen hier auch das Wohl jedes einzelnen Gastes und seine ganzheitliche Erholung und Vitalisierung für Körper, Geist und Seele im Vordergrund. Das OCÉANO - Konzept basiert auf vier Grundsätzen und zielt darauf ab, einen nachhaltigen Urlaub mit Präventions- und Regenerationsmedizin zu verbinden. Diese Grundsätze umfassen im Einzelnen: die Ganzheitlichkeit der Gesundheitsmethoden, die Natürlichkeit der Maßnahmen zum Fördern der Gesundheit, die Einhaltung der hohen Qualitätsstandards sowie die ökologische Verantwortung bzw. die Verpflichtung gegenüber der Natur, sie in all ihrer Schönheit zu erhalten. Das OCÉANO Hotel Health Spa ist Mitglied und anerkanntes Zentrum der Internationalen Gesellschaft der Mayr Ärzte, wurde im September 2013 in den exklusiven Verband der Healing Hotels of the World aufgenommen und im Dezember 2013 vom TÜV Rheinland in der Kategorie „International Spa Standard“ zertifiziert.","","","En Bus a 180 m (Parada Altagay) para las líneas 105  ( Santa Cruz- La Laguna - Punta del Hidalgo ) 050 ( La Laguna -Tegueste- Bajamar -Punta del Hidalgo) 224 (Intercambiador de La Laguna - Valle de Guerra- Punta del Hidalgo)","","","","","","","",""
"Tina","Sur","(28.044523467176724, -16.53791069984436)","38612","Avda. Amalia, 1 -  El Médano","922176914","922176914","","","","2012-09-26 12:48:16","24 horas","Apartamento","Alojamientos","1","apartamentostina@hotmail.com","Granadilla de Abona","Animales,Televisión,","0 m","","","5 m","","60 Km","","","","","2 apartamentos","1 llave","","","","","","","","","","","","","","",""
"Florida","Norte","(28.41151163626435, -16.556246280670166)","38400","C/ Calafate, 3 ","922 37 00 68","922 38 70 51","http://www.luabay.com","","","2014-01-27 16:42:55","","Apartamento","Alojamientos","1","recepcion.floridaplaza@luabay.com","Puerto de la Cruz (El)","Lavandería,Parking,Piscinas,Recepción,Solarium,","250 m. ","","","10 m. ","","27 km. aprox. ","","","","","48","2 llaves","Luabay Hotels & Leisure","","","","","","","","","","","","","",""
"Teidemar","Norte","(28.415012549538893, -16.536548137664795)","38400","C/ Aceviño, 6 Urb. La Paz","922 38 08 24","922 38 56 01","http://www.coral-hotels.com","","","2014-01-29 17:16:42","","Apartamento","Alojamientos","1","info@coral-hotels.com","Puerto de la Cruz (El)","Animales,Inst. infantiles,Jardín-Terraza,Recepción,Tenis,Vigilante,WIFI,","","","","","","27 km. aprox. ","","","","","166","3 llaves","","","","","","","","","","","","","","",""
"Park Plaza","Norte","(28.416026943485313, -16.55144512653351)","38400","C/ José Arroyo, 2","922 38 41 12","922 37 13 38","http://www.grupopezazul.es","","","2014-01-28 18:23:05","","Apartamento","Alojamientos","1","reservas@grupopezazul.es","Puerto de la Cruz (El)","Lavandería,Piscinas,Recepción,Restaurante,Solarium,Vigilante,WIFI,","","","","","","27 km. aprox. ","","1","","1","49","2 llaves","Grupo Pez Azul","","","","","","","","","","","","","",""
"Durazno","Sur","(28.04599589951142, -16.538495421409607)","38612","Avda. Príncipes de España, 1- El Médano","922176958","922176299","http://www.apartamentosdurazno.com","","","2012-09-26 12:47:06","24 horas","Apartamento","Alojamientos","1","duraznosur@teidemail.com","Granadilla de Abona","Lavandería,Recepción,Sala lectura,Televisión,TV Sat.,WIFI,","0 m","","","5 m","","65 Km","","","","","37","2 llaves","","","","","","","","","","","","","","",""
"Casablanca","Norte","(28.41342095366973, -16.542790531893843)","38400","Czda. de Martiánez, 4 ","922 37 18 14","922 37 42 09","http://www.apartamentoscasablanca.com","","","2014-01-21 19:40:07","","Apartamento","Alojamientos","1","reservas@aptoscasablanca.com","Puerto de la Cruz (El)","Bar,Cafetería,Gimnasio,Jardín-Terraza,Lavandería,Parking,Piscina climatizada,Recepción,Sala Juego,Sauna,Televisión,Vigilante,","500 m. aprox.","200 m.","","10 m. ","","27 km. aprox. ","","1","1","","287","3 llaves","","","","","","","","","","","","","","",""
"Club Ambassador ","Norte","(28.407445178610345, -16.538188755403098)","38400","C/ Granados, 18.- Urb. El Durazno","922 38 15 66","922 37 50 35","","","","2014-06-27 20:05:03","","Apartamento","Alojamientos","1","info@apto-ambassador.com  ","Puerto de la Cruz (El)","Jacuzzi,Jardín-Terraza,Lavandería,Parking,Recepción,Serv. médico,Solarium,Televisión,Vigilante,","1,5 km.","1 km. ","","250 m. ","","27 km. aprox. ","","1","","","20","3 llaves","","","","","","","","","","","","","","",""
"Florida Plaza","Norte","(28.415923145481265, -16.553075909614563)","38400","C/ Puerto Viejo, 30 ","922 37 11 40","922 38 70 51","http://www.luabay.com","","","2014-06-27 20:10:22","","Apartamento","Alojamientos","1","recepcion.floridaplaza@luabay.com ","Puerto de la Cruz (El)","Cafetería,Parking,Piscina climatizada,Recepción,Restaurante,Sala Juego,Sala TV,Solarium,Vigilante,","600 m.","","","","","27 km. aprox. ","","","","","132","3 llaves","Luabay Hotels & Leisure","","","","","","","","","","","","","",""
"Florasol","Norte","(28.409237396096507, -16.55040979385376)","38400","Cno. El Coche, 7 ","922 38 98 48","922 38 95 74","http://www.aparthotelflorasol.com","","","2014-06-27 20:09:06","","Apartamento","Alojamientos","1","hotel@apartahotel-florasol","Puerto de la Cruz (El)","Animales,Jardín-Terraza,Parking,Recepción,Solarium,","","","","","","27 km. aprox. ","","","","","29","3 llaves","","","","","","","","","","","","","","",""
"Carabela (La)","Norte","(28.413578227097087, -16.53968095779419)","38400","Avda. Richard Yeoward, 3 ","922 38 48 12","922 37 45 87","http://www.grupopezazul.es","","","2014-06-27 19:13:39","","Apartamento","Alojamientos","1","reservas@grupoazul.es","Puerto de la Cruz (El)","Jardín-Terraza,Lavandería,Recepción,Sala TV,Serv. médico,Zona naturista,","300 m. ","","","","","27 km. aprox. ","","2","1","1","76","4 llaves","Grupo Pez Azul","","","","","","","","","","","","","",""
"Club La Mar","Sur","","38400","Avda. Marítima, 25","922 86 22 57","922 86 25 39","http://www.petcheyleisure.com","","","2011-11-23 14:06:34","","Apartamento","Alojamientos","1","clmreception@petcheyleisure.com","Santiago del Teide","Cafetería,Lavandería,Recepción,Serv. médico,Supermercado,Televisión,Vigilante,","","","","","","","","","","","38","1 llave","","","","","","","","","","","","","","",""
"Dragos, Los","Norte","(28.407161283601166, -16.551986932754516)","38400","Avda. 8 de Marzo, 4 Urb.- Parque Las Flores ","922 38 67 00","922 37 00 19","http://www.hoteles-losdragos.com","","","2014-06-27 20:06:33","","Apartamento","Alojamientos","1","reservasnorte@hoteles-losdragos.com","Puerto de la Cruz (El)","Internet,Jardín-Terraza,Lavandería,Piscinas,Recepción,Restaurante,Sala TV,Serv. médico,Solarium,Televisión,TV Sat.,Vigilante,","1 km. ","","","","","27 km. aprox. ","","","","","24","3 llaves","","","","","","","","","","","","","","",""
"Casa María","Sur","(28.35635117169124, -16.406140565522946)","38530","C/ La Cueva, 28. Las Cuevecitas.","922 503 762","","http://www.casamariateneriffa.com","","","2014-05-26 11:50:40","","Apartamento","Alojamientos","1","info@casamariateneriffa.com","Candelaria","Animales,Lavandería,Parking,Serv. médico,Solarium,","","","","Sólo en la carretera vieja. ","","","","Sí.","","","8","2 llaves","+34 922 503 762","","","","","","Salida autopista Candelaria - Araya. Conectar con la carretera vieja Tf-28, tomar dirección Malpaís - Cuevecitas. ","","","","","","","",""
"Bambi","Norte","(28.415726557977564, -16.54507577397453)","38400","C/ Enrique Talg, 15","922 38 46 89","922 37 36 84","http://www.apartamentosbambi.com","","","2011-11-18 15:59:22","","Apartamento","Alojamientos","1","info@apartahotelastoria.com","Puerto de la Cruz (El)","Cafetería,Lavandería,Piscinas,Recepción,Sala TV,Serv. médico,Spa,Vigilante,","50 m.","200 m.","","50 m.","","27 km. aprox. ","","","","","41","1 llave","","","","","","","","","","","","","","",""
"Diamante","Sur","(28.2451864, -16.83865049999997)","38000","C/ Tabaiba, 5-7","922 90 17 17","922 86 75 21","http://www.diamondapartments.com","","","2014-06-02 11:30:59","","Apartamento","Alojamientos","1","reservations@diamondgigantes.com","Santiago del Teide","Jardín-Terraza,Lavandería,Parking,Recepción,Serv. médico,Solarium,Vigilante,","","","","","","","","","","","20","1 llave","infinity blue hotels","","","","","","","","","","","","","",""
