"ows_LinkTitle","ows_Zona","ows_Georeferencia","ows_CodigoPostal","ows_Direccion","ows_Telefono","ows_Fax","ows_Web","ows_Mascotas","ows_Accesibilidad","ows_FechaActualizacion","ows_Horarios","ows_TipoActividad","ows_Actividad","ows_Activo","ows_Email","ows_Municipio","ows_Categorias","ows_DistanciaPlaya","ows_DistanciaCentroComercial","ows_DistanciaPuerto","ows_DistanciaParadaBus","ows_DistanciaTFS","ows_DistanciaTFN","ows_Suites","ows_Piscinas","ows_Bares","ows_Restaurantes","ows_Habitaciones","ows_SubTipo","ows_EmpresaNombre","ows_DescripcionEspanol","ows_DescripcionIngles","ows_DescripcionAleman","ows_DescripcionRuso","ows_DescripcionItaliano","ows_ComoLlegarEspanol","ws_ComoLlegarIngles","ows_ComoLlegarAleman","ows_ComoLlegarFrances","ows_ComoLlegarItaliano","ows_HorariosIngles","ows_HorariosAleman","ows_HorariosFrances","ows_HorariosItaliano"
"Aguere","Metropolitana","(28.48967677234651, -16.318953036825405)","38201","C/ Obispo Rey Redondo, 55","922 31 40 36","922 63 16 33","http://www.hotelaguere.es","","","2015-04-11 16:04:42","","Hotel","Alojamientos","1","reservas@hotelaguere.es","San Cristóbal de la Laguna","Bar,Cafetería,Internet,Internet habitación,Jardín-Terraza,Peluquería,Recepción,Sala conferencias,Salón de convenciones,Teléfono en habitación,Televisión,Vigilante,","","","","","","","1","","","","23","1 estrella","","El Hotel Aguere, declarado Patrimonio Histórico-Artístico, está ubicado en pleno casco antiguo de la La Laguna (Tenerife), ciudad declarada Patrimonio de la Humanidad por la UNESCO. En nuestras 23 habitaciones ofrecemos a nuestros clientes un trato personalizado y el mejor servicio. Nos encontramos estratégicamente situados a tan sólo 10 minutos del aeropuerto Tenerife Norte (TFN), a menos de 15km de la capital Santa Cruz de Tenerife y muy próximo a zonas de senderismo, piscinas naturales y de campos de golf y equitación.","","","","","A 10 minutos del Aeropuerto Norte TFN a menos de 15 km de Santa Cruz ","","","","","","","",""
"Finca Salamanca","Sur","(28.2117398, -16.42387880000001)","38500","Ctra. Güímar Km.1,5. El Puertito","922 51 45 30","922 51 40 61","http://www.hotel-fincasalamanca.com","","","2012-01-03 12:51:08","","Hotel rural","Alojamientos","1","info@hotel-fincasalamanca.com","Güímar","Adaptada (discapacitados),Recepción,Televisión,","3 Km","","3 Km","En el hotel","","28 Km","","1","","1","20","2 palmeras","","","","","","","","","","","","","","",""
"Cango (El)","Sur","","38580","C/ Vera Los Cangueros 8-10.","922 16 12 17","922 27 14 81","http://www.tenerifeturismorural.com","","","2013-12-05 16:42:42","","Casa rural","Alojamientos","1","","Arico","","","","","","","","","","","","1","","","EXCLUSIVO","","","","","","","","","","","","",""
"Hotel Rural San Miguel","Sur","(28.0968497, -16.61951929999998)","38620","C/ Las Morales, 2","922 16 79 22","922 16 79 49","http://www.hotelruralsanmiguel.com","","","2013-05-23 10:17:02","","Hotel rural","Alojamientos","1","reservas@hotelruralsanmiguel.com","San Miguel de Abona","Jardín-Terraza,Piscina cubierta,Solarium,Teléfono en habitación,Televisión,","","","","","","","","","","","14","2 palmeras","","","","","","","","","","","","","","",""
"Casa Anton Piche","Sur","(28.115404576773262, -16.564078330993652)","38600","C/ Principal, 38 - El Draguito","922772838 ","922770148","http://www.antonpiche.com","","","2012-09-26 10:33:20","24 horas","Casa rural","Alojamientos","1","antonpichesur@msn.com","Granadilla de Abona","Internet,Lavandería,Parking,Recepción,Sala Juego,Sala lectura,Sala TV,Solarium,Televisión,Terraza,TV Sat.,","","","","","","","","","","","3","2 Palmeras","","COMPARTIDO PROPIETARIO","","","","","","","","","","","","",""
"Iberostar Grand Hotel Mencey","Metropolitana","(28.474736703545524, -16.253124475479126)","38004","C/ Doctor José Naveiras, 38","922 60 99 00","922 28 00 17","http://www.grandhotelmencey.com/","","","2015-05-14 11:34:55","","Hotel","Alojamientos","1","hotel.mencey@iberostar.com","Santa Cruz de Tenerife","","8 km","500 m","1 km","frente al hotel","","12 km","49","1","3","1","Standard-211, Suite-48 y Suite Real-1.","5 estrellas","Iberostar Hotels & Resorts","","","","","","","","","","","","","",""
"Senderos de Abona","Sur","(28.125756419100383, -16.57684564590454)","38600","C/ La Iglesia, 5 - Granadilla","922770200","922770308","http://www.senderosdeabona.com","","","2012-09-26 12:48:01","Recepción 08 - 22 h","Hotel rural","Alojamientos","1","info@senderosdeabona.com","Granadilla de Abona","Bar,Cafetería,Inst. infantiles,Internet,Internet habitación,Jardín-Terraza,Lavandería,Piscinas,Recepción,Restaurante,Sala Juego,Sala lectura,Sala TV,Solarium,Teléfono en habitación,Televisión,Terraza,TV Sat.,Vigilante,WIFI,","11 Km","","","Si","","","1","1","1","1","16","2 palmeras","","","","","","","","","","","","","","",""
"Tilos (Los)","Norte","(28.3980426, -16.347982300000012)","38290","Preventorio, 17","922 54 86 91","","http://www.hotel-lostilos.com","","","2011-11-24 16:14:42","","Hotel rural","Alojamientos","1","","Rosario (El)","Jardín-Terraza,Recepción,Teléfono en habitación,","","","","","","","","","","","7","2 palmeras","","","","","","","","","","","","","","",""
"Riquelas (Las)","Norte","(28.4543764, -16.440130700000054)","38360","Camino Baboseras, s/n. (Las Riquelas)","922 59 51 00","922 55 09 04","http://www.lasriquelas.com","","","2013-12-17 16:25:33","","Casa rural","Alojamientos","1","","Sauzal (El)","Televisión,","","","","","","","","","","","2","","","EXCLUSIVO","","","","","","","","","","","","",""
"Mama Lola","Sur","","38580","C/ Trece de Septiembre, 11","922 16 12 17","922 27 14 81","http://www.tenerifeturismorural.com","","","2013-12-05 18:00:20","","Casa rural","Alojamientos","1","","Arico","","","","","","","","","","","","2","","","EXCLUSIVO","","","","","","","","","","","","",""
"Raya (La)","Sur","","38500","La Raya, 25. Barrio de La Hoya","922 51 38 38","922 51 48 57","http://www.fincalaraya.com","","","2012-01-03 13:28:14","","Hotel rural","Alojamientos","1","casalaraya@hotmail.com","Güímar","Recepción,Teléfono en habitación,","4 Km","","","","","33 Km","3","","","","3","2 palmeras","","","","","","","","","","","","","","",""
"Finca San Juan","Sur","(28.3900845, -16.643830999999977)","38420","Cno. Mazape, 3","922 69 40 78","922 69 41 00","http://www.finca-san-juan.com","","","2013-12-16 16:43:10","","Hotel rural","Alojamientos","1","info1@finca-san-juan.com","San Juan de la Rambla","Calefacción,Distintivo calidad,Jardín-Terraza,Lavandería,Parking,Ping-Pong,Piscina climatizada,Radio en habitación,Recepción,Restaurante,Sauna,Serv. habitaciones,Solarium,Televisión,Tenis,Terraza,TV Sat.,WIFI,","","","","","","","","","","","8","2 palmeras","","","","","","","","","","","","","","",""
"Los Partidos","Isla Baja","(28.316205483166588, -16.792201339267194)","38435","Los Partidos, 4","620107911","","http://www.caseriolospartidos.com","","","2014-06-03 10:58:58","","Hotel rural","Alojamientos","1","info@caseriolospartidos.com","Tanque (El)","Animales,Bar,Cafetería,Calefacción,Parking,Recepción,Restaurante,Sala TV,Terraza,","","","","","","57.329","","","","","11","2 palmeras","","","","","","","","","","","","","","",""
"Tenerife Playa","Norte","(28.418598270651607, -16.542963981628418)","38400","Avda. de Colón, 12","922 38 32 11","922 38 37 91","http://www.h10hotels.com","","","2014-01-29 17:36:38","","Hotel","Alojamientos","1","h10.tenerife.playa@h10.hotels.com","Puerto de la Cruz (El)","Espectáculos,Internet,Jacuzzi,Jardín-Terraza,Lavandería,Piscina climatizada,Piscinas,Sala TV,Serv. habitaciones,Serv. médico,WIFI,Zona naturista,","20 m.","300 m. ","","","","27 km. aprox. ","","2","2","1","340","4 estrellas","H10","","","","","","","","","","","","","",""
"Tigaiga","Norte","(28.41094543995787, -16.549572944641113)","38400","Parque Taoro, 28","922 38 35 00","922 38 40 55","http://www.tigaiga.com","","","2014-01-29 18:56:25","","Hotel","Alojamientos","1","info@tigaiga.com","Puerto de la Cruz (El)","Inst. infantiles,Jardín-Terraza,Peluquería,Piscina climatizada,Sala conferencias,Sala lectura,Sauna,Tiendas,","1,5 km. ","","","","","27 km. aprox. ","7","1","1","1","83","4 estrellas","","","","","","","","","","","","","","",""
"Nogal (El)","Sur","(28.1186654, -16.665306099999952)","38614","Camino Real, S/N.","922 72 60 50","922 72 58 53","http://www.hotelnogal.com","","","2011-11-23 16:45:36","","Hotel rural","Alojamientos","1","nogal@hotelnogal.com","Vilaflor","Parking,Recepción,Teléfono en habitación,Televisión,","","","","","","","","","","","20","1 palmera","","","","","","","","","","","","","","",""
" Mortero","Norte","(28.3485821, -16.702249199999983)","38430","Calle Marengo, 18","922 81 18 72","","","","","2014-07-03 10:38:26","","Casa rural","Alojamientos","1","israelabreuluis@yahoo.es","Icod de los Vinos","Teléfono en habitación,","","","","","","","","","","","2","","","EXCLUSIVO","","","","","","","","","","","","",""
"Valle Mar","Norte","(28.417862264116397, -16.544294357299804)","38400","Avda. de Colón, 4","922 38 48 00","922 38 34 08","http://www.vallemar.com","","","2014-01-29 19:17:50","","Hotel","Alojamientos","1","info@vallemar.com","Puerto de la Cruz (El)","Animales,Bar,Jardín-Terraza,Piscinas,Recepción,Restaurante,Sala conferencias,Sala lectura,Salón de convenciones,","200 m.","","","","","27 km. aprox. ","","","2","2","171","4 estrellas","","","","","","","","","","","","","","",""
"Catalonia Las Vegas","Norte","(28.417214322312947, -16.544807553073042)","38400","Avda. de Colón,  2","922 38 39 00","922 38 68 05","http://www.hoteles-catalonia.es","","","2014-01-22 17:47:40","","Hotel","Alojamientos","1","lasvegas@hoteles-catalonia.es","Puerto de la Cruz (El)","Aire Acondicionado,Bar,Espectáculos,Jardín-Terraza,Piscinas,Radio en habitación,Restaurante,Sala conferencias,Sauna,Solarium,TV Sat.,","50 m.","200 m.","","","","27 km. aprox. ","","","2","1","261","4 estrellas","Hoteles Catalonia","","","","","","","","","","","","","",""
"Monopol","Norte","(28.417357436163172, -16.548526883125305)","38400","C/ Quintana, 15","922 38 46 11","922 37 03 10","http://www.monopoltf.com","","","2014-01-28 17:47:11","","Hotel","Alojamientos","1","info@monopoltf.com ","Puerto de la Cruz (El)","Aire Acondicionado,Animales,Bar,Jacuzzi,Ping-Pong,Piscina climatizada,Restaurante,Sala conferencias,Sala Juego,Sala lectura,Sauna,Televisión,","100 m. ","","","","","27 km. aprox.","","1","2","1","100","3 estrellas","","","","","","","","","","","","","","",""
"Heliotropos (Los)","Norte","(28.4370663, -16.461022800000023)","38380","C/ La Resbala, 21","922 58 03 19","922","","","","2011-11-22 13:38:21","","Casa rural","Alojamientos","1","","Victoria de Acentejo (La)","Piscinas,Solarium,Teléfono en habitación,Televisión,","","","","","","19.917","","1","","","4","","","COMPARTIDO OTROS USUARIOS","","","","","","","","","","","","",""
"Costa Salada","Metropolitana","(28.53531311354814, -16.38340473175049)","38270","Cno. La Costa, s/n. Finca Oasis. Tejina","922 69 00 00","922 54 10 55","http://www.costasalada.com","","","2015-04-29 09:59:24","","Hotel rural","Alojamientos","1","hotelrural@costasalada.com","San Cristóbal de la Laguna","","7,3 km.","","","1,5 km.","","15 km.","3","","","","9","2 palmeras","","En el fin del mundo parece ubicarse este hotel rural en la Laguna, inmerso en una finca de 240.000 m2. En una parte se cultivan plantas ornamentales y otras plantas autóctonas tinerfeñas y canarias mirando de frente al mar. El resto de la finca es salvaje con los típicos arboles tarajales de la zona y se puede explorar siguiendo sus senderos. Frente a este hotel rural con encanto se extiende una cala de piedra que enamorará a todos los amantes del mar. Y para aquellas personas que no les guste la experiencia marítima, se ha dispuesto en el exterior una piscina y un jacuzzi. ","The family hotel seems to be located at the World's end, embedded in a property of 240.000sq.m. In  one area ornamental plants, and in the area facing the sea some indigenous Canary plants can be found. The rest of the property is wild and uncultivated with the typical Trajinaste plants of the area, which you can explore by following its paths. A stone bay which extends in front of the hotel will win the heart of all sea lovers, and for those  who don’t like the sea experience, there is a Jacuzzi and an outdoor pool which is heated depending on the season.","Man könnte sagen, das Hotel in La Laguna befindet sich am Ende der Welt, eingebettet in 240.000 m2 Land. Auf der einen Seite des Hotels kann man Zierpflanzen vorfinden und auf der Seite, die zum Meer hinzeigt, wachsen typische Pflanzen aus Teneriffa und von den Kanaren. Auf dem übrigen Grundstück der Finca kann man wild wachsende Pflanzen vorfinden wie die typische Tajinaste-Pflanze aus der Region. Der Besucher kann auf Entdeckungsreise der Tajinaste gehen, indem er den angelegten Pfaden folgt. Vor dem charmanten Landhotel erstreckt sich eine kleine Steinbucht, die die Herzen aller Meerliebhaber gewinnen wird. Für die Gäste, die keine Meerliebhaber sind, befindet sich ein Jacuzzi und ein je nach Jahreszeit beheiztes Schwimmbad im Hotel.","","","El Hotel Rural Costa Salada se encuentra a tan sólo 15 km. Del aeropuerto del norte de Tenerife, Los Rodeos y a 80 km del aeropuerto del sur, el Reina Sofía. El establecimiento está situado en Valle Guerra, a 20 km de San Cristóbal de La Laguna.","The Rural Hotel Costa Salada is located at just 15km from Tenerife North Airport, Los Rodeos, and at 80km from Tenerife South Airport, Reina Sofia.  The hotel is located in Valle Guerra, 20km from La Laguna.","Das Landhotel Costa Salada ist nur etwa 15 km vom Nordflughafen Los Rodeos entfernt und etwa 80 km vom Südflughafen Reina Sofia. Das Hotel befindet sich in Valle Guerra, 20 km von La Laguna entfernt","","","","","",""
"Maga","Norte","(28.415654213815642, -16.54967486858368)","38400","C/ Iriarte, 11 ","922 38 38 53","922 38 25 55","http://www.hotelmagapuertodelacruz.com","","","2014-06-30 18:56:46","","Hotel","Alojamientos","1","grupomaga@ctr.es  ","Puerto de la Cruz (El)","Bar,Internet,Restaurante,Terraza,","600 m. ","","","","","27 km. aprox. ","","","1","1","24","1 estrella","","","","","","","","","","","","","","",""
"Quinta Roja (La)","Isla Baja","(28.373380699280666, -16.763179376721382)","38450","Glorieta San Francisco, s/n","922 13 33 77","922 13 33 60","http://www.quintaroja.com","","","2015-06-06 12:31:44","","Hotel rural","Alojamientos","1","hotelquintaroja@quintaroja.com","Garachico","","","","","","","","","","","","20","2 palmeras","","","","","","","","","","","","","","",""
"Maestro (El)","Sur","(28.3528144, -16.382069499999943)","38540","Lomo Juan Díaz, 19B. Las Cuevecitas","922 68 82 10","","http://www.casadelmaestro.ergos.es","","","2014-05-26 11:49:42","","Casa rural","Alojamientos","1","casadelmaestro@arrakis.es","Candelaria","","5 km","5 km","5 Km","1 km","","21,6 km","No ","No","No","No","2","1 Palmera","","Casa del Maestro es una casa dotada de un salón-comedor-cocina, un baño, y 2 habitaciones (1 individual y otra doble). Ofrece vistas al mar y cuenta con un patio, una huerta y una zona recreativa exterior. Se alquila de manera íntegra para un total de 3 personas.","It a house with lounge-dining-room, kitchen, a bathroom and 2 rooms ( a single and double room). From here you can see the sea. The house has a courtyard, vegetable garden and an outdoor recreational facilities.  The house is rented at the maximum 3 persons. ","","","","Desde la Tf1 coger la salida de Candelaria hacia Las Cuevecitas","From highway Tf1 to take the Candelaria's exit to Las Cuevecitas","","De l'autoroute Tf1 prendre la sortie à Candelaria-Las Cuevecitas","","","","",""
"Verita (La)","Sur","(28.2384949, -16.45578660000001)","38570","C/ La Vera, 8","922 50 07 09","922 50 07 09","http://www.lasombrera.com","","","2013-12-05 19:49:42","","Casa rural","Alojamientos","1","lasombrera@gmail.com","Fasnia","Teléfono en habitación,","","","","","","","","","","","1","","","EXCLUSIVO","","","","","","","","","","","","",""
"El Traspatio","Sur","(28.123395643592104, -16.576459407806396)","38600","C/ Arquitecto Marrero, 9 - Granadilla","922630596","922630596","http://www.eltraspatio.com","","","2012-09-26 12:51:00","","Casa rural","Alojamientos","1","casaruraleltraspatio@gmail.com","Granadilla de Abona","Teléfono en habitación,","11 Km","","","10 m","","60 Km","","","","","3 Apartamentos de una habitación","","","","","","","","","","","","","","","",""
"Casa Ida","Isla Baja","(28.365720177943853, -16.744805574417114)","38459","C/ La Oliva, 8. Genovés.","922 13 32 97","922 13 32 97","http://www.ruralida.com","","","2015-03-27 12:35:50","","Casa rural","Alojamientos","1","ida@ruralida.com","Garachico","Jacuzzi,Lavandería,Teléfono en habitación,Televisión,Terraza,WIFI,","","","","","","","","","","","","","","","","","","","","","","","","","","",""
"Uchan, Casa","Norte","(28.3485821, -16.702249199999983)","38430","Caserío Marengo, 16","922 81 43 22","","","","","2014-07-03 11:03:03","","Casa rural","Alojamientos","1","","Icod de los Vinos","","","","","","","","","","","","2","","","Exclusivo","","","","","","","","","","","","",""
"Padrón","Metropolitana","(28.4880386, -16.318649400000027)","38202","C/ Nuñez de la Peña, 29","922 25 91 16 ","922 25 91 16","http://www.pensionpadron.com","","","2015-04-22 19:24:11","","Pensión","Alojamientos","1","pensionpadron1953@hotmail.com","San Cristóbal de la Laguna","","13 km","","13 km.","450 m.","","3,5 km.","","","","","20","","","Es una pensión dirigida de manera familiar, situada en el centro de la ciudad rodeada de todas los servicios necesarios","","","","","esta situado a poca distancia de la parada del tranvia , desde la autopista TF 5, Avda de la Trinidad , C/ San Juan ,C/ Manuel de Ossuna,C/ Nuñez de la Peña","","","","","","","",""
"Don Leandro","Norte","(28.476706, -16.33273859999997)","38370","Ctra. La Esperanza, Km.16","922 69 03 07","922 24 34 41","http://www.donleandro.net","","","2011-11-23 16:38:45","","Casa rural","Alojamientos","1","","Rosario (El)","Teléfono en habitación,","","","","","","","","","","","7","","","Compartido con otros usuarios","","","","","","","","","","","","",""
"Marquesa/Condesa","Norte","(28.417285092971444, -16.548574268708762)","38400","C/ Quintana, 11","922 38 31 51","922 38 69 50","http://www.hotelmarquesa.com","","","2014-01-23 18:49:07","","Hotel","Alojamientos","1","reservas@hotelmarquesa.com","Puerto de la Cruz (El)","Serv. médico,","250 m. ","600 m. ","","","","27 km. aprox. ","","2","1","1","46","3 estrellas","","","","","","","","","","","","","","",""
